;;;;;;;;;;;;;;;;;;;;;;;;;;;;;;;;;;;;;;;;;;;;;;;;;;;
;;;;;;;;;;;;;;;;;;;;;;;;;;;;;;;;;;;;;;;;;;;;;;;;;;;
;;;;;;;;;;;;;;;;;;;;;;;;;;;;;;;;;;;;;;;;;;;;;;;;;;;
;;;;;;;;;;;;;;;;;;;;;;;;;;;;;;;;;;;;;;;;;;;;;;;;;;;
;;;;;;;;;;;;;;;;;;;;;;;;;;;;;;;;;;;;;;;;;;;;;;;;;;;
1;2;3;4;5;6;7;8;9;10;11;12;13;14;15;16;17;18;19;20;21;22;23;24;25;26;27;28;29;30;31;32;33;34;35;36;37;38;39;40;41;42;43;44;45;46;47;48;49;50;51;52
№ строки;Наименование показателя;Всего (сумма граф 4-47);Программы начального общего образования с нормативным сроком обучения 4 года 1-й класс;Программы начального общего образования с нормативным сроком обучения 4 года 2-й класс;Программы начального общего образования с нормативным сроком обучения 4 года 3-й класс;Программы начального общего образования с нормативным сроком обучения 4 года 4-й класс;Программы начального общего образования с нормативным сроком обучения 5–6 лет 1-й класс;Программы начального общего образования с нормативным сроком обучения 5–6 лет 1-й класс первого года обучения;Программы начального общего образования с нормативным сроком обучения 5–6 лет 1-й класс второго года обучения;Программы начального общего образования с нормативным сроком обучения 5–6 лет 2-й класс;Программы начального общего образования с нормативным сроком обучения 5–6 лет 2-й класс первого года обучения;Программы начального общего образования с нормативным сроком обучения 5–6 лет 2-й класс второго года обучения;Программы начального общего образования с нормативным сроком обучения 5–6 лет 3-й класс;Программы начального общего образования с нормативным сроком обучения 5–6 лет 3-й класс первого года обучения;Программы начального общего образования с нормативным сроком обучения 5–6 лет 3-й класс второго года обучения;Программы начального общего образования с нормативным сроком обучения 5–6 лет 4-й класс;Программы начального общего образования с нормативным сроком обучения 5–6 лет 4-й класс первого года обучения;Программы начального общего образования с нормативным сроком обучения 5–6 лет 4-й класс второго года обучения;Программы основного общего образования с нормативным сроком освоения 5 лет 5-й класс;Программы основного общего образования с нормативным сроком освоения 5 лет 6-й класс;Программы основного общего образования с нормативным сроком освоения 5 лет 7-й класс;Программы основного общего образования с нормативным сроком освоения 5 лет 8-й класс;Программы основного общего образования с нормативным сроком освоения 5 лет 9-й класс;Программы основного общего образования с нормативным сроком освоения 6 лет 5-й класс;Программы основного общего образования с нормативным сроком освоения 6 лет 5-й класс первого года обучения;Программы основного общего образования с нормативным сроком освоения 6 лет 5-й класс второго года обучения;Программы основного общего образования с нормативным сроком освоения 6 лет 6-й класс;Программы основного общего образования с нормативным сроком освоения 6 лет 6-й класс первого года обучения;Программы основного общего образования с нормативным сроком освоения 6 лет 6-й класс второго года обучения;Программы основного общего образования с нормативным сроком освоения 6 лет 7-й класс;Программы основного общего образования с нормативным сроком освоения 6 лет 7-й класс первого года обучения;Программы основного общего образования с нормативным сроком освоения 6 лет 7-й класс второго года обучения;Программы основного общего образования с нормативным сроком освоения 6 лет 8-й класс;Программы основного общего образования с нормативным сроком освоения 6 лет 8-й класс первого года обучения;Программы основного общего образования с нормативным сроком освоения 6 лет 8-й класс второго года обучения;Программы основного общего образования с нормативным сроком освоения 6 лет 9-й класс;Программы основного общего образования с нормативным сроком освоения 6 лет 9-й класс первого года обучения;Программы основного общего образования с нормативным сроком освоения 6 лет 9-й класс второго года обучения;Программы среднего общего образования с нормативным сроком освоения 2 года 10-й класс;Программы среднего общего образования с нормативным сроком освоения 2 года 11-й класс;Программы среднего общего образования с нормативным сроком освоения 3 года 10-й класс;Программы среднего общего образования с нормативным сроком освоения 3 года 10-й класс первого года обучения;Программы среднего общего образования с нормативным сроком освоения 3 года 10-й класс второго года обучения;Программы среднего общего образования с нормативным сроком освоения 3 года 11-й класс;Программы среднего общего образования с нормативным сроком освоения 3 года 11-й класс первого года обучения;Программы среднего общего образования с нормативным сроком освоения 3 года 11-й класс второго года обучения;Из общей численности обучающихся (из гр. 3): лица с ограниче- нными возможно- стями здоровья;Из общей численности обучающихся (из гр. 3): из них: инвалиды;Из общей численности обучающихся (из гр. 3): из них: дети-инвалиды;Из общей численности обучающихся (из гр. 3): инвалиды  (кроме учтенных в гр. 49);Из общей численности обучающихся (из гр. 3): дети-инвалиды  (кроме учтенных в гр. 50)
1;Число классов для глухих, ед.;1068;3;3;2;1;49;38;38;85;8;7;76;9;13;42;44;64;21;16;18;24;22;30;8;9;55;10;6;62;2;1;46;14;22;39;57;71;21;22;2;;;;4;4;;;;;
2;В них обучающихся, чел.;5562;13;15;11;6;256;195;202;466;50;25;382;48;46;213;220;348;120;90;110;115;115;176;34;44;282;59;34;336;14;4;229;73;111;199;303;359;111;108;5;;;;16;19;3755;209;3471;;
3;Число классов для слабослышащих и позднооглохших, ед.;1510;16;17;11;18;77;53;53;101;13;6;111;18;6;60;72;105;18;15;21;22;14;73;11;6;97;4;2;104;6;3;97;10;12;47;59;94;26;20;2;4;1;2;2;1;;;;;
4;В них обучающихся, чел.;8937;93;103;95;107;421;335;275;553;97;32;630;114;20;350;431;642;90;95;137;158;93;440;76;31;577;33;12;629;35;20;560;67;74;271;371;541;139;112;10;31;5;14;13;5;6604;332;5612;;
5;Число классов для слепых, ед.;300;4;6;4;4;12;8;7;21;1;3;19;1;4;14;10;14;2;5;3;4;6;15;;;17;1;;19;;;14;;;5;20;19;19;17;1;;;1;;;;;;;
6;В них обучающихся, чел:       cлепых;1334;11;14;16;19;63;26;32;110;1;9;85;9;29;67;45;67;18;39;18;31;32;57;;;76;1;;88;;;56;;;10;92;69;71;64;1;;;8;;;778;50;702;;
7;слабовидящих и поздноослепших;392;;7;5;;5;22;3;5;10;13;29;;7;24;9;10;;;;;;34;;;26;;;43;;;34;;;3;38;21;22;22;;;;;;;316;10;213;;
8;Число классов для слабовидящих и поздноослепших, ед.;1671;85;86;91;101;64;24;18;90;7;2;80;6;1;23;65;70;58;50;50;51;44;42;1;;82;1;;79;2;;91;3;1;35;68;82;49;62;3;;;2;1;1;;;;;
9;В них обучающихся, чел:       слабовидящих и поздноослепших;14069;963;965;979;1104;436;174;127;631;49;6;552;39;4;160;518;566;572;468;474;459;393;359;5;;690;15;;622;13;;696;29;11;228;531;667;220;313;19;;;8;2;2;9375;101;3123;;
10;cлепых;788;16;21;15;20;37;22;11;63;1;9;61;3;;18;51;51;9;4;4;7;5;25;;;54;;;57;;;65;3;1;18;31;45;30;30;1;;;;;;513;30;386;;
11;Число классов для обучающихся с тяжелыми нарушениями речи, ед.;1784;184;186;178;176;28;85;68;76;11;;64;9;;70;12;1;55;44;48;40;39;65;1;;70;1;;67;2;;60;4;3;19;52;59;4;3;;;;;;;;;;;
12;В них обучающихся, чел.;19888;2133;2173;2120;2105;274;930;692;819;131;;718;114;;701;151;14;575;485;524;429;424;722;11;;740;12;;735;18;;660;53;37;214;569;582;18;5;;;;;;;14692;32;1799;;
13;Число классов для обучающихся с нарушением опорно-двигательного аппарата, ед.;1735;67;67;73;77;24;79;74;89;4;;85;2;1;67;5;3;72;86;79;86;91;59;2;;78;3;;67;1;;61;2;;26;51;59;105;81;1;1;;4;;3;;;;;
14;В них обучающихся, чел.;8580;426;442;459;496;131;384;342;391;18;;427;10;1;336;24;14;379;487;436;462;470;272;16;;321;14;;309;5;;301;9;;139;230;229;341;219;3;7;;11;;19;5174;88;3185;;21
15;Число классов для обучающихся с задержкой психического развития, ед.;9032;279;415;512;593;59;402;449;436;56;8;409;48;9;399;48;21;726;982;958;980;1022;20;5;1;28;1;;26;;;29;;1;13;34;25;20;18;;;;;;;;;;;
16;В них обучающихся, чел.;93579;2507;3759;4984;6158;521;3719;4524;4570;584;64;4619;535;113;4491;543;197;7586;10679;10369;10797;11278;96;24;6;168;1;;150;;;208;;11;126;97;56;20;19;;;;;;;61856;41;5831;5;70
17;Число классов для обучающихся с расстройствами аутистического спектра, ед.;471;20;9;7;10;38;94;68;50;11;6;42;12;2;27;4;5;5;6;6;7;3;3;1;;10;;;7;;;8;;;4;;2;;4;;;;;;;;;;;
18;В них обучающихся, чел.;2142;105;35;37;22;143;483;380;221;95;27;173;86;12;61;26;21;21;34;38;32;13;3;1;;19;;;15;;;17;;;13;;5;;4;;;;;;;1301;12;1128;;
19;Число классов для обучающихся со сложными дефектами, ед.;202;5;5;6;8;6;6;6;11;1;;16;3;2;10;13;9;8;8;10;11;12;3;1;;8;;;10;;;10;2;1;2;6;3;;;;;;;;;;;;;
20;В них обучающихся, чел.;1103;33;25;36;41;19;29;32;66;5;;98;5;4;64;59;52;41;32;64;73;64;16;1;;46;;;62;;;62;8;5;11;35;15;;;;;;;;;914;20;749;;
21;Число классов для обучающихся с иными ограниченными возможностями здоровья (кроме классов для обучающихся с умственной отсталостью (интеллектуальными нарушениями), ед.;756;41;38;47;43;2;21;16;10;4;1;11;3;;10;2;2;54;57;65;85;84;4;;;7;;;6;;;7;;;2;2;8;58;66;;;;;;;;;;;
22;В них обучающихся, чел.;4115;234;244;319;328;28;163;129;119;27;5;125;24;;109;9;20;319;341;378;450;372;4;;;17;;;16;;;16;;;2;11;40;135;131;;;;;;;2758;42;1563;1;3
23;Итого классов (сумма строк 01,03, 05, 08, 11, 13, 15, 17, 19, 21);18529;704;832;931;1031;359;810;797;969;116;33;913;111;38;722;275;294;1019;1269;1258;1310;1337;314;30;16;452;21;8;447;13;4;423;35;40;192;349;422;302;293;9;5;1;9;7;9;;;;;
24;В них обучающихся (сумма строк 02, 04, 06, 07, 09, 10, 12, 14, 16, 18, 20, 22);160489;6534;7803;9076;10406;2334;6482;6749;8014;1068;190;7899;987;236;6594;2086;2002;9730;12754;12552;13013;13259;2204;168;81;3016;135;46;3062;85;24;2904;242;250;1234;2308;2629;1107;1027;39;38;5;41;31;45;104882;959;26317;4;220
25;из них (из строки 24):       воспитанники (без приходящих учащихся);21656;537;732;752;802;575;971;978;1414;224;47;1389;247;78;1068;594;740;809;899;829;763;847;663;74;36;944;49;21;986;49;13;899;69;79;338;752;778;282;281;17;;;7;16;8;12846;311;5766;;1
26;девочки;54860;2215;2621;3001;3502;828;1940;2110;2650;340;59;2610;280;93;2180;796;826;3322;4375;4327;4387;4471;826;75;30;1122;50;24;1186;27;8;1016;93;101;459;860;980;508;474;13;18;3;20;17;17;31866;336;8213;;33
27;лица с ограниченными возможностями здоровья;159741;6494;7777;9035;10364;2322;6462;6738;8006;1057;190;7889;986;236;6592;2086;2002;9631;12667;12484;12902;13160;2203;168;81;3016;135;46;3061;85;24;2904;242;250;1233;2307;2629;1079;1002;39;38;5;41;31;42;;;;;
28;из них (из строки 27):             инвалиды;1959;35;43;35;42;33;30;60;75;30;8;48;27;13;13;39;44;41;33;30;42;41;42;3;;37;;;37;;;65;;3;87;65;311;122;361;4;6;3;19;8;24;;;;;
29;дети-инвалиды;40169;1187;1269;1237;1265;1360;2437;2142;2909;371;114;2713;326;122;1698;1101;1386;1233;1436;1412;1543;1376;1181;144;70;1692;100;45;1750;52;24;1608;167;201;692;1285;1317;691;397;27;32;2;21;19;15;;;;;
30;инвалиды (кроме учтенных в строке 28);25;;;1;3;3;5;;;;;;;;4;;;;3;1;1;1;;;;;;;;;;;;;;;1;;2;;;;;;;;;;;
31;дети-инвалиды (кроме учтенных в строке 29);461;25;20;32;28;14;19;2;15;4;;1;1;;2;;;66;43;52;56;42;1;;;;;;1;;;;;;;1;;17;16;;;;;;3;;;;;
32;дети-сироты и дети, оставшиеся без попечения       родителей;3907;86;104;147;177;23;87;117;141;17;2;137;16;7;167;36;34;244;411;448;527;557;55;1;4;57;;;59;;;71;;2;41;48;59;14;10;;;;;;1;2097;19;305;;
33;из них воспитанники (без приходящих учащихся);730;18;18;24;19;3;11;21;28;1;1;24;;1;26;9;15;35;54;57;94;113;19;;;22;;;19;;;22;;2;18;21;28;2;5;;;;;;;367;2;102;;
