;;;;;;;;;;;;;;;;;;;;;;;
;;;;;;;;;;;;;;;;;;;;;;;
;;;;;;;;;;;;;;;;;;;;;;;
;;;;;;;;;;;;;;;;;;;;;;;
;;;;;;;;;;;;;;;;;;;;;;;
1;2;3;4;5;6;7;8;9;10;11;12;13;14;15;16;17;18;19;20;21;22;23;24
№ строки;Наименование показателей;Все классы, кроме классов для обучающихся с ограниченными возможностями здоровья Всего (сумма граф 9–11);Все классы, кроме классов для обучающихся с ограниченными возможностями здоровья из них лица с ограни- ченными возможностя- ми здоровья;Все классы, кроме классов для обучающихся с ограниченными возможностями здоровья из них из графы 4 инвалиды;Все классы, кроме классов для обучающихся с ограниченными возможностями здоровья из них из графы 4 дети-инвалиды;Все классы, кроме классов для обучающихся с ограниченными возможностями здоровья из них инвалиды (кроме учтенных в графе 5);Все классы, кроме классов для обучающихся с ограниченными возможностями здоровья из них дети-инвалиды (кроме учтенных в графе 6);Все классы, кроме классов для обучающихся с ограниченными возможностями здоровья Из графы 3 обучались очно;Все классы, кроме классов для обучающихся с ограниченными возможностями здоровья Из графы 3 обучались очно-заочно;Все классы, кроме классов для обучающихся с ограниченными возможностями здоровья Из графы 3 обучались заочно;Классы для обучающихся с ограниченными возможностями здоровья Всего;Классы для обучающихся с ограниченными возможностями здоровья из них лица с ограни- ченными возможностя- ми здоровья;Классы для обучающихся с ограниченными возможностями здоровья из них из графы 13 инвалиды;Классы для обучающихся с ограниченными возможностями здоровья из них из графы 13 дети-инвалиды;Классы для обучающихся с ограниченными возможностями здоровья из них инвалиды (кроме учтенных в графе 14);Классы для обучающихся с ограниченными возможностями здоровья из них дети-инвалиды (кроме учтенных в графе 15);Итого по всем классам (сумма граф 3, 12);Кроме того, численность экстернов;из них лица с ограни- ченными возможностя- ми здоровья;из них из графы 20 инвалиды;из них из графы 20 дети-инвалиды;из них инвалиды (кроме учтенных в графе 21);из них дети-инвалиды (кроме учтенных в графе 22)
1;Численность обучающихся (гр. 3–18) и экстернов (гр. 19–24), допущенных к ГИА по образовательным программам основного общего образования (сумма строк 02, 04, 05);11709;202;9;71;8;58;11582;123;4;169;135;5;18;;2;11878;36;10;;8;;1
2;в том числе:       получили аттестат об основном общем образовании;11694;188;7;66;8;58;11567;123;4;161;127;5;13;;2;11855;34;8;;6;;1
3;из них (из строки 02) продолжили обучение по образовательной          программе среднего общего образования в данной организации;4003;28;;23;3;22;3997;6;;5;4;;3;;1;4008;2;;;;;
4;получили на ГИА неудовлетворительные результаты;;;;;;;;;;;;;;;;;;;;;;
5;не участвовали в ГИА;15;14;2;5;;;15;;;8;8;;5;;;23;2;2;;2;;
6;Из строки 02 получили аттестат об основном общем образовании:    с отличием;1260;7;;7;;5;1259;1;;3;3;;;;;1263;5;;;;;
7;в IV квартале прошлого года;310;4;;;;2;310;;;;;;;;;310;4;;;;;
8;после 1 сентября текущего года;;;;;;;;;;;;;;;;;;;;;;
9;Численность обучающихся (графы 3–18) и экстернов (графы 19–24), допущенных к ГИА по образовательным программам среднего общего образования (сумма строк 10–12);3947;12;;10;7;32;3902;44;1;3;1;;1;;2;3950;27;;;;;
10;в том числе:       получили аттестат о среднем общем образовании;3947;12;;10;7;32;3902;44;1;3;1;;1;;2;3950;27;;;;;
11;получили на ГИА неудовлетворительные результаты;;;;;;;;;;;;;;;;;;;;;;
12;не участвовали в ГИА;;;;;;;;;;;;;;;;;;;;;;
13;Из строки 10 получили аттестат о среднем общем образовании:    с отличием и медаль «За особые успехи в учении»;1144;7;;5;1;6;1143;1;;;;;;;;1144;4;;;;;
14;в IV квартале прошлого года;111;;;;;1;111;;;;;;;;;111;;;;;;
15;после 1 сентября текущего года;;;;;;;;;;;;;;;;;;;;;;
16;Из общей численности участвовавших в ГИА (из суммы строк 10 и 11)    участвовали в едином государственном экзамене (ЕГЭ)*;3156;10;;9;6;24;3146;9;1;2;1;;1;;1;3158;20;;;;;
17;участвовали в ЕГЭ по русскому языку (из строки 16);3090;8;;7;4;23;3080;9;1;2;1;;1;;1;3092;20;;;;;
18;из них сдали ЕГЭ;3042;8;;7;4;20;3032;9;1;2;1;;1;;1;3044;20;;;;;
19;участвовали в ЕГЭ по математике (из строки 16);3057;8;;7;4;23;3047;9;1;;;;;;;3057;20;;;;;
20;из них сдали ЕГЭ;2990;8;;7;4;22;2980;9;1;;;;;;;2990;20;;;;;
21;участвовали в ГИА в иной (кроме ЕГЭ) форме*;791;2;;1;1;8;756;35;;1;;;;;1;792;7;;;;;
22;Выпущено лиц, не получивших основного общего и среднего общего образования, со свидетельством об обучении;47;33;2;19;;;46;;1;55;51;5;21;;1;102;2;1;;1;;
23;"Справочно. Код по ОКЕИ: человек – 792  Из численности обучавшихся во всех классах, получивших аттестат о сред-нем общем образовании с отличием и медаль «За особые успехи в учении» (из строки 13 графы 18):    получили аттестат красного цвета и медаль ""За особые успехи    в учении"" I степени";722;;;;;;;;;;;;;;;;;;;;;
24;"получили аттестат сине-голубого цвета и медаль ""За особые успехи    в учении"" II степени";422;;;;;;;;;;;;;;;;;;;;;
25;"Из численности обучавшихся экстернов, получивших аттестат о среднем общем образовании с отличием и медаль «За особые успехи в учении» (из строки 13 графы 19):    получили аттестат красного цвета и медаль ""За особые успехи    в учении"" I степени";4;;;;;;;;;;;;;;;;;;;;;
26;"получили аттестат сине-голубого цвета и медаль ""За особые успехи    в учении"" II степени";;;;;;;;;;;;;;;;;;;;;;
;;;;;;;;;;;;;;;;;;;;;;;
;;Сумма строк 16 и 21 равна сумме строк 10 и 11 по всем графам;Сумма строк 16 и 21 равна сумме строк 10 и 11 по всем графам;Сумма строк 16 и 21 равна сумме строк 10 и 11 по всем графам;Сумма строк 16 и 21 равна сумме строк 10 и 11 по всем графам;Сумма строк 16 и 21 равна сумме строк 10 и 11 по всем графам;;;;;;;;;;;;;;;;;
