;;;;;;;;;;;;;;;;;;;;;;;;;;;;;;;;;;;;;;;;;;;;;;;;;;;
;;;;;;;;;;;;;;;;;;;;;;;;;;;;;;;;;;;;;;;;;;;;;;;;;;;
;;;;;;;;;;;;;;;;;;;;;;;;;;;;;;;;;;;;;;;;;;;;;;;;;;;
;;;;;;;;;;;;;;;;;;;;;;;;;;;;;;;;;;;;;;;;;;;;;;;;;;;
;;;;;;;;;;;;;;;;;;;;;;;;;;;;;;;;;;;;;;;;;;;;;;;;;;;
1;2;3;4;5;6;7;8;9;10;11;12;13;14;15;16;17;18;19;20;21;22;23;24;25;26;27;28;29;30;31;32;33;34;35;36;37;38;39;40;41;42;43;44;45;46;47;48;49;50;51;52
№ строки;Наименование показателя;Всего (сумма граф 4-47);Программы начального общего образования с нормативным сроком обучения 4 года 1-й класс;Программы начального общего образования с нормативным сроком обучения 4 года 2-й класс;Программы начального общего образования с нормативным сроком обучения 4 года 3-й класс;Программы начального общего образования с нормативным сроком обучения 4 года 4-й класс;Программы начального общего образования с нормативным сроком обучения 5–6 лет 1-й класс;Программы начального общего образования с нормативным сроком обучения 5–6 лет 1-й класс первого года обучения;Программы начального общего образования с нормативным сроком обучения 5–6 лет 1-й класс второго года обучения;Программы начального общего образования с нормативным сроком обучения 5–6 лет 2-й класс;Программы начального общего образования с нормативным сроком обучения 5–6 лет 2-й класс первого года обучения;Программы начального общего образования с нормативным сроком обучения 5–6 лет 2-й класс второго года обучения;Программы начального общего образования с нормативным сроком обучения 5–6 лет 3-й класс;Программы начального общего образования с нормативным сроком обучения 5–6 лет 3-й класс первого года обучения;Программы начального общего образования с нормативным сроком обучения 5–6 лет 3-й класс второго года обучения;Программы начального общего образования с нормативным сроком обучения 5–6 лет 4-й класс;Программы начального общего образования с нормативным сроком обучения 5–6 лет 4-й класс первого года обучения;Программы начального общего образования с нормативным сроком обучения 5–6 лет 4-й класс второго года обучения;Программы основного общего образования с нормативным сроком освоения 5 лет 5-й класс;Программы основного общего образования с нормативным сроком освоения 5 лет 6-й класс;Программы основного общего образования с нормативным сроком освоения 5 лет 7-й класс;Программы основного общего образования с нормативным сроком освоения 5 лет 8-й класс;Программы основного общего образования с нормативным сроком освоения 5 лет 9-й класс;Программы основного общего образования с нормативным сроком освоения 6 лет 5-й класс;Программы основного общего образования с нормативным сроком освоения 6 лет 5-й класс первого года обучения;Программы основного общего образования с нормативным сроком освоения 6 лет 5-й класс второго года обучения;Программы основного общего образования с нормативным сроком освоения 6 лет 6-й класс;Программы основного общего образования с нормативным сроком освоения 6 лет 6-й класс первого года обучения;Программы основного общего образования с нормативным сроком освоения 6 лет 6-й класс второго года обучения;Программы основного общего образования с нормативным сроком освоения 6 лет 7-й класс;Программы основного общего образования с нормативным сроком освоения 6 лет 7-й класс первого года обучения;Программы основного общего образования с нормативным сроком освоения 6 лет 7-й класс второго года обучения;Программы основного общего образования с нормативным сроком освоения 6 лет 8-й класс;Программы основного общего образования с нормативным сроком освоения 6 лет 8-й класс первого года обучения;Программы основного общего образования с нормативным сроком освоения 6 лет 8-й класс второго года обучения;Программы основного общего образования с нормативным сроком освоения 6 лет 9-й класс;Программы основного общего образования с нормативным сроком освоения 6 лет 9-й класс первого года обучения;Программы основного общего образования с нормативным сроком освоения 6 лет 9-й класс второго года обучения;Программы среднего общего образования с нормативным сроком освоения 2 года 10-й класс;Программы среднего общего образования с нормативным сроком освоения 2 года 11-й класс;Программы среднего общего образования с нормативным сроком освоения 3 года 10-й класс;Программы среднего общего образования с нормативным сроком освоения 3 года 10-й класс первого года обучения;Программы среднего общего образования с нормативным сроком освоения 3 года 10-й класс второго года обучения;Программы среднего общего образования с нормативным сроком освоения 3 года 11-й класс;Программы среднего общего образования с нормативным сроком освоения 3 года 11-й класс первого года обучения;Программы среднего общего образования с нормативным сроком освоения 3 года 11-й класс второго года обучения;Из общей численности обучающихся (из гр. 3): лица с ограниче- нными возможно- стями здоровья;Из общей численности обучающихся (из гр. 3): из них: инвалиды;Из общей численности обучающихся (из гр. 3): из них: дети-инвалиды;Из общей численности обучающихся (из гр. 3): инвалиды  (кроме учтенных в гр. 49);Из общей численности обучающихся (из гр. 3): дети-инвалиды  (кроме учтенных в гр. 50)
1;Число классов для глухих, ед.;15;1;1;1;1;;;;;;;;;;;;;1;1;1;2;2;;;;;;;;;;;;;;;2;;;;;;;;2;;;;;
2;В них обучающихся, чел.;80;8;6;7;8;;;;;;;;;;;2;;7;3;4;10;8;;;;;;;;;;;;;;;10;;;;;;;1;6;9;7;2;;
3;Число классов для слабослышащих и позднооглохших, ед.;11;;;;;1;;;1;;;;;;;1;1;1;;;1;;1;;;1;;;1;;;;;;;;1;;;;;;;;1;;;;;
4;В них обучающихся, чел.;54;;;1;;7;;;5;;;;;;;3;1;4;;;6;1;4;;;5;;;5;;;2;;;;;2;;6;;;;;;2;10;10;;;
5;Число классов для слепых, ед.;0;;;;;;;;;;;;;;;;;;;;;;;;;;;;;;;;;;;;;;;;;;;;;;;;;
6;В них обучающихся, чел:       cлепых;0;;;;;;;;;;;;;;;;;;;;;;;;;;;;;;;;;;;;;;;;;;;;;;;;;
7;слабовидящих и поздноослепших;0;;;;;;;;;;;;;;;;;;;;;;;;;;;;;;;;;;;;;;;;;;;;;;;;;
8;Число классов для слабовидящих и поздноослепших, ед.;0;;;;;;;;;;;;;;;;;;;;;;;;;;;;;;;;;;;;;;;;;;;;;;;;;
9;В них обучающихся, чел:       слабовидящих и поздноослепших;0;;;;;;;;;;;;;;;;;;;;;;;;;;;;;;;;;;;;;;;;;;;;;;;;;
10;cлепых;0;;;;;;;;;;;;;;;;;;;;;;;;;;;;;;;;;;;;;;;;;;;;;;;;;
11;Число классов для обучающихся с тяжелыми нарушениями речи, ед.;5;1;1;1;1;;;;;;;;;;;;;;;1;;;;;;;;;;;;;;;;;;;;;;;;;;;;;;
12;В них обучающихся, чел.;104;3;7;1;2;;;;;;;;;;;;;;;1;;;;;;;;;;;;;;;;;;;90;;;;;;;;;;;
13;Число классов для обучающихся с нарушением опорно-двигательного аппарата, ед.;15;;2;2;2;;2;;;;;;;;;;;2;;2;1;2;;;;;;;;;;;;;;;;;;;;;;;;;;;;
14;В них обучающихся, чел.;105;;13;13;11;;10;;;;;;;;;;;18;;18;9;13;;;;;;;;;;;;;;;;;;;;;;;;;;;;
15;Число классов для обучающихся с задержкой психического развития, ед.;8;;;2;;;;;;;;;;;;;;1;1;1;1;1;;;;;;;;;;;;;1;;;;;;;;;;;;;;;
16;В них обучающихся, чел.;76;1;;19;;;;;;;;;;;;;;13;10;9;11;11;;;;;;;;;;;;;2;;;;;;;;;;;;;;;
17;Число классов для обучающихся с расстройствами аутистического спектра, ед.;0;;;;;;;;;;;;;;;;;;;;;;;;;;;;;;;;;;;;;;;;;;;;;;;;;
18;В них обучающихся, чел.;0;;;;;;;;;;;;;;;;;;;;;;;;;;;;;;;;;;;;;;;;;;;;;;;;;
19;Число классов для обучающихся со сложными дефектами, ед.;0;;;;;;;;;;;;;;;;;;;;;;;;;;;;;;;;;;;;;;;;;;;;;;;;;
20;В них обучающихся, чел.;1;;;;;;;;;;;;;;;1;;;;;;;;;;;;;;;;;;;;;;;;;;;;;;;;;;
21;Число классов для обучающихся с иными ограниченными возможностями здоровья (кроме классов для обучающихся с умственной отсталостью (интеллектуальными нарушениями)), ед.;5;1;;;1;;;;;;;;;;;;;1;1;;;1;;;;;;;;;;;;;;;;;;;;;;;;;;;;
22;В них обучающихся, чел.;30;;;;;;;;;;;;;;;;;8;11;;;11;;;;;;;;;;;;;;;;;;;;;;;;;;;;
23;Итого классов (сумма стр. 01,03, 05, 08, 11, 13, 15, 17, 19, 21);59;3;4;6;5;1;2;0;1;0;0;0;0;0;0;1;1;6;3;5;5;6;1;0;0;1;0;0;1;0;0;0;0;0;1;0;3;0;0;0;0;0;0;0;3;;;;;
24;В них обучающихся (сумма стр. 02, 04, 06, 07, 09, 10, 12, 14, 16, 18, 20, 22);450;12;26;41;21;7;10;0;5;0;0;0;0;0;0;6;1;50;24;32;36;44;4;0;0;5;0;0;5;0;0;2;0;0;2;0;12;0;96;0;0;0;0;1;8;23;17;2;;
25;из них (из строки 24):       воспитанники (без приходящих учащихся);71;;7;5;7;7;;;5;;;;;;;3;1;8;;2;9;1;4;;;2;;;4;;;;;;;;6;;;;;;;;;;;;;
26;девочки;107;1;8;11;7;2;5;;;;;;;;;2;1;12;8;11;8;17;2;;;1;;;1;;;;;;1;;4;;2;;;;;1;2;5;4;1;;
27;лица с ограниченными возможностями здоровья;245;3;20;15;13;7;10;;5;;;;;;;3;1;35;10;27;26;25;4;;;5;;;5;;;2;;;2;;12;;6;;;;;1;8;;;;;
28;из них (из стр.27):             инвалиды;23;;;1;;;;;;;;;;;;;;2;;;;1;;;;;;;;;;2;;;;;2;;6;;;;;1;8;;;;;
29;дети-инвалиды;135;2;13;13;;6;8;;5;;;;;;;3;1;21;;15;15;12;3;;;4;;;4;;;;;;;;10;;;;;;;;;;;;;
30;инвалиды (кроме учтенных в строке 28);0;;;;;;;;;;;;;;;;;;;;;;;;;;;;;;;;;;;;;;;;;;;;;;;;;
31;дети-инвалиды (кроме учтенных в строке 29);0;;;;;;;;;;;;;;;;;;;;;;;;;;;;;;;;;;;;;;;;;;;;;;;;;
32;дети-сироты и дети, оставшиеся без попечения       родителей;24;;4;4;5;;;;;;;;;;;;;4;;2;3;1;;;;;;;;;;;;;;;1;;;;;;;;;;;;;
33;из них воспитанники (без приходящих учащихся);24;;4;4;5;;;;;;;;;;;;;4;;2;3;1;;;;;;;;;;;;;;;1;;;;;;;;;;;;;
