;;;;;;;;;;;;;;;;;;;;;;;
;;;;;;;;;;;;;;;;;;;;;;;
;;;;;;;;;;;;;;;;;;;;;;;
;;;;;;;;;;;;;;;;;;;;;;;
;;;;;;;;;;;;;;;;;;;;;;;
1;2;3;4;5;6;7;8;9;10;11;12;13;14;15;16;17;18;19;20;21;22;23;24
№ строки;Наименование показателей;Все классы, кроме классов для обучающихся с ограниченными возможностями здоровья Всего (сумма граф 9–11);Все классы, кроме классов для обучающихся с ограниченными возможностями здоровья из них лица с ограни- ченными возможностя- ми здоровья;Все классы, кроме классов для обучающихся с ограниченными возможностями здоровья из них из графы 4 инвалиды;Все классы, кроме классов для обучающихся с ограниченными возможностями здоровья из них из графы 4 дети-инвалиды;Все классы, кроме классов для обучающихся с ограниченными возможностями здоровья из них инвалиды (кроме учтенных в графе 5);Все классы, кроме классов для обучающихся с ограниченными возможностями здоровья из них дети-инвалиды (кроме учтенных в графе 6);Все классы, кроме классов для обучающихся с ограниченными возможностями здоровья Из графы 3 обучались очно;Все классы, кроме классов для обучающихся с ограниченными возможностями здоровья Из графы 3 обучались очно-заочно;Все классы, кроме классов для обучающихся с ограниченными возможностями здоровья Из графы 3 обучались заочно;Классы для обучающихся с ограниченными возможностями здоровья Всего;Классы для обучающихся с ограниченными возможностями здоровья из них лица с ограни- ченными возможностя- ми здоровья;Классы для обучающихся с ограниченными возможностями здоровья из них из графы 13 инвалиды;Классы для обучающихся с ограниченными возможностями здоровья из них из графы 13 дети-инвалиды;Классы для обучающихся с ограниченными возможностями здоровья из них инвалиды (кроме учтенных в графе 14);Классы для обучающихся с ограниченными возможностями здоровья из них дети-инвалиды (кроме учтенных в графе 15);Итого по всем классам (сумма граф 3, 12);Кроме того, численность экстернов;из них лица с ограни- ченными возможностя- ми здоровья;из них из графы 20 инвалиды;из них из графы 20 дети-инвалиды;из них инвалиды (кроме учтенных в графе 21);из них дети-инвалиды (кроме учтенных в графе 22)
1;Численность обучающихся (гр. 3–18) и экстернов (гр. 19–24), допущенных к ГИА по образовательным программам основного общего образования (сумма строк 02, 04, 05);13330;78;8;45;;59;13327;2;1;24;24;3;7;;;13354;10;;;;;
2;в том числе:       получили аттестат об основном общем образовании;13310;70;8;40;;59;13307;2;1;13;13;3;6;;;13323;10;;;;;
3;из них (из строки 02) продолжили обучение по образовательной          программе среднего общего образования в данной организации;4886;11;1;9;;21;4886;;;;;;;;;4886;;;;;;
4;получили на ГИА неудовлетворительные результаты;3;;;;;;3;;;;;;;;;3;;;;;;
5;не участвовали в ГИА;17;8;;5;;;17;;;11;11;;1;;;28;;;;;;
6;Из строки 02 получили аттестат об основном общем образовании:    с отличием;1164;4;;3;;2;1164;;;;;;;;;1164;2;;;;;
7;в IV квартале прошлого года;480;3;;1;;1;480;;;;;;;;;480;1;;;;;
8;после 1 сентября текущего года;8;;;;;;8;;;;;;;;;8;;;;;;
9;Численность обучающихся (графы 3–18) и экстернов (графы 19–24), допущенных к ГИА по образовательным программам среднего общего образования (сумма строк 10–12);4874;9;;9;;17;4859;3;12;;;;;;;4874;9;;;;;
10;в том числе:       получили аттестат о среднем общем образовании;4867;9;;9;;17;4852;3;12;;;;;;;4867;9;;;;;
11;получили на ГИА неудовлетворительные результаты;7;;;;;;7;;;;;;;;;7;;;;;;
12;не участвовали в ГИА;;;;;;;;;;;;;;;;;;;;;;
13;Из строки 10 получили аттестат о среднем общем образовании:    с отличием и медаль «За особые успехи в учении»;1047;2;;2;;2;1047;;;;;;;;;1047;1;;;;;
14;в IV квартале прошлого года;233;;;;;;233;;;;;;;;;233;;;;;;
15;после 1 сентября текущего года;1;;;;;;1;;;;;;;;;1;;;;;;
16;Из общей численности участвовавших в ГИА (из суммы строк 10 и 11)    участвовали в едином государственном экзамене (ЕГЭ)*;4844;8;;8;;16;4841;3;;;;;;;;4844;9;;;;;
17;участвовали в ЕГЭ по русскому языку (из строки 16);4831;8;;8;;15;4828;3;;;;;;;;4831;8;;;;;
18;из них сдали ЕГЭ;4671;8;;8;;14;4668;3;;;;;;;;4671;8;;;;;
19;участвовали в ЕГЭ по математике (из строки 16);4830;8;;8;;15;4827;3;;;;;;;;4830;9;;;;;
20;из них сдали ЕГЭ;4514;7;;7;;12;4511;3;;;;;;;;4514;8;;;;;
21;участвовали в ГИА в иной (кроме ЕГЭ) форме*;30;1;;1;;1;18;;12;;;;;;;30;;;;;;
22;Выпущено лиц, не получивших основного общего и среднего общего образования, со свидетельством об обучении;56;21;;10;;;56;;;20;19;;9;;;76;;;;;;
23;"Справочно. Код по ОКЕИ: человек – 792  Из численности обучавшихся во всех классах, получивших аттестат о сред-нем общем образовании с отличием и медаль «За особые успехи в учении» (из строки 13 графы 18):    получили аттестат красного цвета и медаль ""За особые успехи    в учении"" I степени";617;;;;;;;;;;;;;;;;;;;;;
24;"получили аттестат сине-голубого цвета и медаль ""За особые успехи    в учении"" II степени";430;;;;;;;;;;;;;;;;;;;;;
25;"Из численности обучавшихся экстернов, получивших аттестат о среднем общем образовании с отличием и медаль «За особые успехи в учении» (из строки 13 графы 19):    получили аттестат красного цвета и медаль ""За особые успехи    в учении"" I степени";;;;;;;;;;;;;;;;;;;;;;
26;"получили аттестат сине-голубого цвета и медаль ""За особые успехи    в учении"" II степени";1;;;;;;;;;;;;;;;;;;;;;
;;;;;;;;;;;;;;;;;;;;;;;
;;Сумма строк 16 и 21 равна сумме строк 10 и 11 по всем графам;Сумма строк 16 и 21 равна сумме строк 10 и 11 по всем графам;Сумма строк 16 и 21 равна сумме строк 10 и 11 по всем графам;Сумма строк 16 и 21 равна сумме строк 10 и 11 по всем графам;Сумма строк 16 и 21 равна сумме строк 10 и 11 по всем графам;;;;;;;;;;;;;;;;;
